{
  "task": "DEMO-42",
  "owner": "primary author session",
  "repository": "verified project remote",
  "branch": "demo-42-title-search",
  "worktree": "../demo-42",
  "head_sha": "3f8a1c2e9b7d4f60a1b2c3d4e5f60718293a4b5c",
  "base_sha": "9c0d1e2f3a4b5c6d7e8f90a1b2c3d4e5f6a7b8c9",
  "approved_scope": [
    "Search existing published entries by title",
    "Show empty and no-results states"
  ],
  "sources": [
    "Product catalogue spec"
  ],
  "completed_ac": [
    "Empty query shows the existing catalogue"
  ],
  "remaining_work": [
    "No-results state",
    "Validation"
  ],
  "uncommitted_changes": [
    {
      "path": "src/catalogue/empty-state.tsx",
      "owner": "primary author session"
    }
  ],
  "tests": [
    {
      "command": "npm test",
      "result": "PASS",
      "tested_state": "dirty"
    }
  ],
  "pr": "not opened",
  "ci": "not run",
  "unresolved_findings": [],
  "collisions": "file overlap only with DEMO-43",
  "merge_order": "no semantic dependency",
  "next_allowed_action": "Re-verify state, then implement no-results state",
  "human_decisions": []
}
